{
  "schemaVersion": "1.1.0",
  "taskType": "review",
  "report": {
    "reportId": "r-001",
    "title": "t",
    "course": "c",
    "studentCode": "S1"
  },
  "rubricVersion": "1.0.0",
  "rubric": {
    "id": "rb",
    "version": "1.0.0",
    "title": "rb",
    "items": [
      {
        "id": "R1",
        "name": "a",
        "weight": 60,
        "maxScore": 10,
        "evidenceRequirement": "e",
        "deductionNotes": "d",
        "levels": [
          {
            "level": "excellent",
            "label": "优秀",
            "criterion": "c1",
            "scoreRatio": 1.0
          },
          {
            "level": "meeting",
            "label": "达标",
            "criterion": "c2",
            "scoreRatio": 0.8
          },
          {
            "level": "partial",
            "label": "部分达标",
            "criterion": "c3",
            "scoreRatio": 0.5
          },
          {
            "level": "notMet",
            "label": "未达标",
            "criterion": "c4",
            "scoreRatio": 0.0
          }
        ]
      },
      {
        "id": "R2",
        "name": "b",
        "weight": 40,
        "maxScore": 10,
        "evidenceRequirement": "e",
        "deductionNotes": "d",
        "levels": [
          {
            "level": "excellent",
            "label": "优秀",
            "criterion": "c1",
            "scoreRatio": 1.0
          },
          {
            "level": "meeting",
            "label": "达标",
            "criterion": "c2",
            "scoreRatio": 0.8
          },
          {
            "level": "partial",
            "label": "部分达标",
            "criterion": "c3",
            "scoreRatio": 0.5
          },
          {
            "level": "notMet",
            "label": "未达标",
            "criterion": "c4",
            "scoreRatio": 0.0
          }
        ]
      }
    ]
  },
  "scores": [
    {
      "rubricItemId": "R1",
      "itemName": "a",
      "weight": 60,
      "maxScore": 10,
      "level": "excellent",
      "levelScoreRatio": 1.0,
      "score": 10,
      "suggestedScore": 10,
      "overriddenByTeacher": false,
      "deductionReason": null,
      "evidence": [
        {
          "id": "E1",
          "kind": "text",
          "location": {
            "section": "1.1"
          },
          "quote": "q",
          "confidence": 0.9,
          "citationValid": true
        }
      ],
      "confidence": 0.9,
      "needsReview": false,
      "pending": false
    },
    {
      "rubricItemId": "R2",
      "itemName": "b",
      "weight": 40,
      "maxScore": 10,
      "level": "meeting",
      "levelScoreRatio": 0.8,
      "score": 8,
      "suggestedScore": 8,
      "overriddenByTeacher": false,
      "deductionReason": "扣分",
      "evidence": [
        {
          "id": "E1",
          "kind": "text",
          "location": {
            "section": "1.1"
          },
          "quote": "q",
          "confidence": 0.9,
          "citationValid": true
        }
      ],
      "confidence": 0.9,
      "needsReview": false,
      "pending": false
    }
  ],
  "totalScore": 92.0,
  "total": {
    "weightIncluded": 100.0,
    "weightExcluded": 0.0,
    "upperBound": 100.0,
    "isPartial": false,
    "grade": "A"
  },
  "review": {
    "triggered": false,
    "triggerReason": null,
    "opinion": "ok",
    "overallConfidenceBefore": 0.9,
    "overallConfidenceAfter": 0.9,
    "adjustments": []
  },
  "feedback": {
    "overall": "o",
    "strengths": [
      "s"
    ],
    "improvements": [
      "i"
    ],
    "tone": "neutral"
  },
  "steps": [
    {
      "step": 1,
      "agent": "parser",
      "inputSummary": "i",
      "outputSummary": "o",
      "confidence": 0.9
    }
  ],
  "provenance": {
    "generatorAgent": "AutoGrader Expert",
    "generatedAt": "2026-09-25T23:00:00+08:00",
    "sourceConversationId": "x",
    "resultFingerprint": "sha256:cb18d8e2a1bdef698e4a2b103feed2aca6281079b12663cf96bd224fcea6697f",
    "schemaVersion": "1.1.0"
  }
}